{
  "id": "network.dns.lookup-path",
  "title": "How an application looks up a name",
  "labels": [
    "topic:network.dns.lookup-path"
  ],
  "blocks": [
    {
      "id": "summary",
      "body": "Applications do not speak DNS. They call `getaddrinfo()`, which checks `/etc/hosts` first and only then asks DNS through the stub resolver. Tools like `dig` skip the first step, so they can disagree with what an application sees.",
      "labels": [
        "section:summary"
      ]
    },
    {
      "id": "what",
      "body": "The chain `application -> getaddrinfo() -> /etc/hosts -> stub resolver -> nameserver`. The first source that returns an address wins.",
      "labels": [
        "section:what"
      ]
    },
    {
      "id": "diagram",
      "body": "::artifact{type=diagram ref=dns-resolution-flow}",
      "labels": [
        "topic:network.dns.resolution"
      ]
    },
    {
      "id": "why",
      "body": "`/etc/hosts` predates DNS and still allows local overrides (e.g. `localhost`). DNS is consulted for everything else.",
      "labels": [
        "section:why"
      ]
    },
    {
      "id": "mechanism",
      "body": "glibc follows the `hosts:` line of `/etc/nsswitch.conf` (usually `files dns`). musl (Alpine, this lab) has no NSS: it always reads `/etc/hosts`, then `/etc/resolv.conf`, then sends the DNS query. `strace` makes this visible as `openat(\"/etc/hosts\")`, `openat(\"/etc/resolv.conf\")` and a `sendto(...port 53...)`.",
      "labels": [
        "section:mechanism"
      ]
    },
    {
      "id": "example",
      "body": "`getent hosts api.shop.example` uses the same path as `curl`. `dig api.shop.example` asks DNS only. If `getent` succeeds but `dig` fails, the answer is coming from `/etc/hosts`.",
      "labels": [
        "section:example"
      ]
    },
    {
      "id": "observe",
      "body": "- `getent hosts <name>`: the application's view.\n- `dig <name>`: the DNS view.\n- `cat /etc/hosts`: local overrides.\n- `strace -f -e trace=openat,sendto,connect getent hosts <name>`: the files read and the packets sent.",
      "labels": [
        "section:observe"
      ]
    },
    {
      "id": "failure_modes",
      "body": "- A stale `/etc/hosts` entry hides a DNS change.\n- Pinning an address in `/etc/hosts` \"fixes\" one name on one host and hides a broken resolver.\n- Testing with `dig` and concluding the application must work (or must fail).",
      "labels": [
        "section:failure_modes"
      ]
    }
  ]
}
